{
  "schemaVersion": 1,
  "lessonId": "memory/method-calls",
  "variantId": "default",
  "source": [
    {
      "path": "Program.java",
      "lines": [
        "public class Program {",
        "    public static void main(String[] args) {",
        "        int x = 2;",
        "        int y = 3;",
        "        int sum = add(x, y);",
        "        Point p = new Point(sum, 0);",
        "        System.out.println(p);",
        "        p = null; // @mark object-dropped",
        "    }",
        "",
        "    static int add(int a, int b) {",
        "        int result = a + b; // @mark add-compute",
        "        return result;",
        "    }",
        "}",
        "",
        "record Point(int x, int y) {}"
      ]
    }
  ],
  "markers": {
    "add-compute": 3,
    "object-dropped": 11
  },
  "steps": [
    {
      "location": {
        "file": "Program.java",
        "line": 3
      },
      "activeThread": "main",
      "threads": [
        {
          "id": "main",
          "name": "main",
          "state": "running",
          "frames": [
            {
              "id": "f1",
              "className": "Program",
              "method": "main",
              "line": 3,
              "locals": [
                {
                  "name": "args",
                  "type": "java.lang.String[]",
                  "value": {
                    "kind": "ref",
                    "id": "o1"
                  }
                }
              ]
            }
          ]
        }
      ],
      "statics": [],
      "heap": [
        {
          "id": "o1",
          "type": "java.lang.String[]",
          "shape": "array",
          "elements": [],
          "state": "live",
          "internal": true,
          "inline": false
        }
      ],
      "console": "",
      "events": [
        {
          "type": "call",
          "thread": "main",
          "frameId": "f1"
        }
      ]
    },
    {
      "location": {
        "file": "Program.java",
        "line": 4
      },
      "activeThread": "main",
      "threads": [
        {
          "id": "main",
          "name": "main",
          "state": "running",
          "frames": [
            {
              "id": "f1",
              "className": "Program",
              "method": "main",
              "line": 4,
              "locals": [
                {
                  "name": "args",
                  "type": "java.lang.String[]",
                  "value": {
                    "kind": "ref",
                    "id": "o1"
                  }
                },
                {
                  "name": "x",
                  "type": "int",
                  "value": {
                    "kind": "primitive",
                    "type": "int",
                    "display": "2"
                  }
                }
              ]
            }
          ]
        }
      ],
      "statics": [],
      "heap": [
        {
          "id": "o1",
          "type": "java.lang.String[]",
          "shape": "array",
          "elements": [],
          "state": "live",
          "internal": true,
          "inline": false
        }
      ],
      "console": "",
      "events": [
        {
          "type": "assign",
          "target": {
            "frameId": "f1",
            "name": "x"
          },
          "value": {
            "kind": "primitive",
            "type": "int",
            "display": "2"
          }
        }
      ]
    },
    {
      "location": {
        "file": "Program.java",
        "line": 5
      },
      "activeThread": "main",
      "threads": [
        {
          "id": "main",
          "name": "main",
          "state": "running",
          "frames": [
            {
              "id": "f1",
              "className": "Program",
              "method": "main",
              "line": 5,
              "locals": [
                {
                  "name": "args",
                  "type": "java.lang.String[]",
                  "value": {
                    "kind": "ref",
                    "id": "o1"
                  }
                },
                {
                  "name": "x",
                  "type": "int",
                  "value": {
                    "kind": "primitive",
                    "type": "int",
                    "display": "2"
                  }
                },
                {
                  "name": "y",
                  "type": "int",
                  "value": {
                    "kind": "primitive",
                    "type": "int",
                    "display": "3"
                  }
                }
              ]
            }
          ]
        }
      ],
      "statics": [],
      "heap": [
        {
          "id": "o1",
          "type": "java.lang.String[]",
          "shape": "array",
          "elements": [],
          "state": "live",
          "internal": true,
          "inline": false
        }
      ],
      "console": "",
      "events": [
        {
          "type": "assign",
          "target": {
            "frameId": "f1",
            "name": "y"
          },
          "value": {
            "kind": "primitive",
            "type": "int",
            "display": "3"
          }
        }
      ]
    },
    {
      "location": {
        "file": "Program.java",
        "line": 12
      },
      "activeThread": "main",
      "threads": [
        {
          "id": "main",
          "name": "main",
          "state": "running",
          "frames": [
            {
              "id": "f1",
              "className": "Program",
              "method": "main",
              "line": 5,
              "locals": [
                {
                  "name": "args",
                  "type": "java.lang.String[]",
                  "value": {
                    "kind": "ref",
                    "id": "o1"
                  }
                },
                {
                  "name": "x",
                  "type": "int",
                  "value": {
                    "kind": "primitive",
                    "type": "int",
                    "display": "2"
                  }
                },
                {
                  "name": "y",
                  "type": "int",
                  "value": {
                    "kind": "primitive",
                    "type": "int",
                    "display": "3"
                  }
                }
              ]
            },
            {
              "id": "f2",
              "className": "Program",
              "method": "add",
              "line": 12,
              "locals": [
                {
                  "name": "a",
                  "type": "int",
                  "value": {
                    "kind": "primitive",
                    "type": "int",
                    "display": "2"
                  }
                },
                {
                  "name": "b",
                  "type": "int",
                  "value": {
                    "kind": "primitive",
                    "type": "int",
                    "display": "3"
                  }
                }
              ]
            }
          ]
        }
      ],
      "statics": [],
      "heap": [
        {
          "id": "o1",
          "type": "java.lang.String[]",
          "shape": "array",
          "elements": [],
          "state": "live",
          "internal": true,
          "inline": false
        }
      ],
      "console": "",
      "events": [
        {
          "type": "call",
          "thread": "main",
          "frameId": "f2"
        }
      ]
    },
    {
      "location": {
        "file": "Program.java",
        "line": 13
      },
      "activeThread": "main",
      "threads": [
        {
          "id": "main",
          "name": "main",
          "state": "running",
          "frames": [
            {
              "id": "f1",
              "className": "Program",
              "method": "main",
              "line": 5,
              "locals": [
                {
                  "name": "args",
                  "type": "java.lang.String[]",
                  "value": {
                    "kind": "ref",
                    "id": "o1"
                  }
                },
                {
                  "name": "x",
                  "type": "int",
                  "value": {
                    "kind": "primitive",
                    "type": "int",
                    "display": "2"
                  }
                },
                {
                  "name": "y",
                  "type": "int",
                  "value": {
                    "kind": "primitive",
                    "type": "int",
                    "display": "3"
                  }
                }
              ]
            },
            {
              "id": "f2",
              "className": "Program",
              "method": "add",
              "line": 13,
              "locals": [
                {
                  "name": "a",
                  "type": "int",
                  "value": {
                    "kind": "primitive",
                    "type": "int",
                    "display": "2"
                  }
                },
                {
                  "name": "b",
                  "type": "int",
                  "value": {
                    "kind": "primitive",
                    "type": "int",
                    "display": "3"
                  }
                },
                {
                  "name": "result",
                  "type": "int",
                  "value": {
                    "kind": "primitive",
                    "type": "int",
                    "display": "5"
                  }
                }
              ]
            }
          ]
        }
      ],
      "statics": [],
      "heap": [
        {
          "id": "o1",
          "type": "java.lang.String[]",
          "shape": "array",